{
  "$schema": "http://json-schema.org/draft-07/schema#",
  "title": "Shatterpoint Stance",
  "type": "object",
  "properties": {
    "id": { "type": "string" },
    "name": { "type": "string" },
    "attack_stats": {
      "type": "object",
      "properties": {
        "melee": { "type": "integer" },
        "ranged": { "type": "integer" }
      }
    },
    "defense_stats": {
      "type": "object",
      "properties": {
        "melee": { "type": "integer" },
        "ranged": { "type": "integer" }
      }
    }
  },
  "required": ["id", "name"]
}
